{
	"@id": "https://case.georgiastandards.org/ims/case/v1p0/CFDocuments/6b049b04-4720-11e7-8d2d-b41056aae514",
	"@type": "ceasn:CompetencyFramework",
	"@context": "http://credreg.net/ctdlasn/schema/context/json",
	"ceasn:name": { "en-us": "Technical College Readiness English - 2016" },
	"ceterms:ctid": "ce-b835c3a8-d745-35c2-afce-922b6ceab7ff",
	"ceasn:hasChild": [
		{ "@id": "https://case.georgiastandards.org/ims/case/v1p0/CFItems/6b18a284-4720-11e7-bff2-7c33bd4867aa" },
		{ "@id": "https://case.georgiastandards.org/ims/case/v1p0/CFItems/6b1aee0e-4720-11e7-ac1d-20478b8536ed" },
		{ "@id": "https://case.georgiastandards.org/ims/case/v1p0/CFItems/6b1b23ba-4720-11e7-918b-e4c39a71a5f0" },
		{ "@id": "https://case.georgiastandards.org/ims/case/v1p0/CFItems/6b1b5696-4720-11e7-88cb-f8dfe8c9a775" },
		{ "@id": "https://case.georgiastandards.org/ims/case/v1p0/CFItems/6b1b6ec4-4720-11e7-abba-d138e6111b79" },
		{ "@id": "https://case.georgiastandards.org/ims/case/v1p0/CFItems/6b1bd3fa-4720-11e7-ac02-530a4a9a88e1" },
		{ "@id": "https://case.georgiastandards.org/ims/case/v1p0/CFItems/6b1c380e-4720-11e7-93cc-e25c9334c543" },
		{ "@id": "https://case.georgiastandards.org/ims/case/v1p0/CFItems/6b1c690a-4720-11e7-aa6d-4a5d6f6da5e9" },
		{ "@id": "https://case.georgiastandards.org/ims/case/v1p0/CFItems/6b1c9ab0-4720-11e7-90b9-0525fd9403be" },
		{ "@id": "https://case.georgiastandards.org/ims/case/v1p0/CFItems/6b1cb360-4720-11e7-b880-923d9caba4bf" },
		{ "@id": "https://case.georgiastandards.org/ims/case/v1p0/CFItems/6b1ce506-4720-11e7-86b8-1efb6ee7440e" },
		{ "@id": "https://case.georgiastandards.org/ims/case/v1p0/CFItems/6b1d2f5c-4720-11e7-bfa0-28b939e63c8e" },
		{ "@id": "https://case.georgiastandards.org/ims/case/v1p0/CFItems/6b1d9226-4720-11e7-a15f-3d5c5d4321f2" },
		{ "@id": "https://case.georgiastandards.org/ims/case/v1p0/CFItems/6b1da9c8-4720-11e7-91a7-b7a2a81e4e99" },
		{ "@id": "https://case.georgiastandards.org/ims/case/v1p0/CFItems/6b1dddd0-4720-11e7-83c0-1944311b2499" },
		{ "@id": "https://case.georgiastandards.org/ims/case/v1p0/CFItems/6b1df586-4720-11e7-9aee-7fc2e6ef0845" },
		{ "@id": "https://case.georgiastandards.org/ims/case/v1p0/CFItems/6b1c80fc-4720-11e7-9ffd-3f12101525ff" },
		{ "@id": "https://case.georgiastandards.org/ims/case/v1p0/CFItems/6b1bb9b0-4720-11e7-b5e8-ff365819e7ff" },
		{ "@id": "https://case.georgiastandards.org/ims/case/v1p0/CFItems/6b1bec5a-4720-11e7-8e89-32353d3babe4" },
		{ "@id": "https://case.georgiastandards.org/ims/case/v1p0/CFItems/6b1c05aa-4720-11e7-8e23-7c1ff72b8167" },
		{ "@id": "https://case.georgiastandards.org/ims/case/v1p0/CFItems/6b1c1e78-4720-11e7-af35-425d5c3d7762" },
		{ "@id": "https://case.georgiastandards.org/ims/case/v1p0/CFItems/6b1c4fb0-4720-11e7-8bfe-caef4658bbb1" },
		{ "@id": "https://case.georgiastandards.org/ims/case/v1p0/CFItems/6b1b3b48-4720-11e7-b3c3-3463ab029b3e" },
		{ "@id": "https://case.georgiastandards.org/ims/case/v1p0/CFItems/6b1e0e4a-4720-11e7-b658-76dba3a47993" },
		{ "@id": "https://case.georgiastandards.org/ims/case/v1p0/CFItems/6b1e2790-4720-11e7-83a4-c05d305c16d8" },
		{ "@id": "https://case.georgiastandards.org/ims/case/v1p0/CFItems/6b1e4004-4720-11e7-a9ff-6c94f3006498" },
		{ "@id": "https://case.georgiastandards.org/ims/case/v1p0/CFItems/6b1e5904-4720-11e7-bbec-6850d94329c6" },
		{ "@id": "https://case.georgiastandards.org/ims/case/v1p0/CFItems/6b1e70b0-4720-11e7-bf0d-de17d6d30ffd" },
		{ "@id": "https://case.georgiastandards.org/ims/case/v1p0/CFItems/6b1b8670-4720-11e7-b48c-a13c54b114dc" },
		{ "@id": "https://case.georgiastandards.org/ims/case/v1p0/CFItems/6b1ba02e-4720-11e7-bcf4-b7c85f1c8397" },
		{ "@id": "https://case.georgiastandards.org/ims/case/v1p0/CFItems/6b1b0844-4720-11e7-b931-9d0f682a8ab1" },
		{ "@id": "https://case.georgiastandards.org/ims/case/v1p0/CFItems/6b1ccc42-4720-11e7-9c3a-5226623e10ae" },
		{ "@id": "https://case.georgiastandards.org/ims/case/v1p0/CFItems/6b1cfd16-4720-11e7-9177-957268c05407" },
		{ "@id": "https://case.georgiastandards.org/ims/case/v1p0/CFItems/6b1d16a2-4720-11e7-8be9-477a077503f8" },
		{ "@id": "https://case.georgiastandards.org/ims/case/v1p0/CFItems/6b1d471c-4720-11e7-8901-847c282ad29b" },
		{ "@id": "https://case.georgiastandards.org/ims/case/v1p0/CFItems/6b1d5ebe-4720-11e7-ba62-2fe4d48aec50" },
		{ "@id": "https://case.georgiastandards.org/ims/case/v1p0/CFItems/6b1d780e-4720-11e7-8615-c92c165e962d" },
		{ "@id": "https://case.georgiastandards.org/ims/case/v1p0/CFItems/6b1dc2dc-4720-11e7-a207-c6e6741d044a" }
	],
	"ceasn:inLanguage": [ "en" ],
	"ceasn:description": { "en-us": "Technical College Readiness English will emphasize reading comprehension, identifying main ideas, making inferences, and distinguishing between direct statements and supporting ideas. The course will also emphasize sentence structure skills. This course will provide an opportunity for students to review reading and writing skills needed for success in Technical College." },
	"ceasn:hasTopChild": [ "https://case.georgiastandards.org/ims/case/v1p0/CFItems/6b18a284-4720-11e7-bff2-7c33bd4867aa", "https://case.georgiastandards.org/ims/case/v1p0/CFItems/6b1b5696-4720-11e7-88cb-f8dfe8c9a775", "https://case.georgiastandards.org/ims/case/v1p0/CFItems/6b1c9ab0-4720-11e7-90b9-0525fd9403be", "https://case.georgiastandards.org/ims/case/v1p0/CFItems/6b1d9226-4720-11e7-a15f-3d5c5d4321f2", "https://case.georgiastandards.org/ims/case/v1p0/CFItems/6b1dddd0-4720-11e7-83c0-1944311b2499" ],
	"ceasn:conceptKeyword": [ { "en-us": "English" } ]
}